{
  "$schema": "https://json-schema.org/draft/2020-12/schema",
  "$id": "https://github.com/mwaddip/santa/schema/santa-transaction.vector.schema.json",
  "title": "SANTA transaction-tier vector",
  "description": "A committed conformance vector for the transaction tier (santa-transaction/v1): a captured/authored tx + its referenced boxes + the provided block context, all as sigma-serialized BYTES (the consensus-unambiguous form — it preserves context-extension wire order, which a JSON object key-reorders), with the JVM-blessed {valid, cost, reason}. Normative companion to docs/contract/runner-contract-transaction.md.",
  "type": "object",
  "required": ["schema", "op", "blessed_by", "entries"],
  "additionalProperties": false,
  "properties": {
    "schema": { "enum": ["santa-transaction/v1"] },
    "op": { "type": "string", "minLength": 1 },
    "blessed_by": { "type": "string", "minLength": 1 },
    "entries": { "type": "array", "minItems": 1, "items": { "$ref": "#/$defs/entry" } }
  },
  "$defs": {
    "entry": {
      "type": "object",
      "required": ["name", "source", "tx_bytes_hex", "input_boxes_hex", "data_input_boxes_hex",
                   "headers_hex", "preHeader", "parameters", "context", "version", "expected"],
      "additionalProperties": false,
      "properties": {
        "name": { "type": "string", "minLength": 1 },
        "source": {
          "description": "Per-entry origin. testnet:<...> => captured provenance (valid:true chain history); santa:<...> => authored (the adversarial reject arm).",
          "type": "string", "minLength": 1
        },
        "description": { "type": "string" },
        "tx_bytes_hex": { "$ref": "#/$defs/hex", "description": "The signed transaction, canonical sigma bytes (parseTransaction input)." },
        "input_boxes_hex": { "type": "array", "items": { "$ref": "#/$defs/hex" }, "minItems": 1, "description": "Spent input boxes as ErgoBox bytes, in tx-input order." },
        "data_input_boxes_hex": { "type": "array", "items": { "$ref": "#/$defs/hex" }, "description": "Data-input boxes as ErgoBox bytes (may be empty)." },
        "headers_hex": { "type": "array", "items": { "$ref": "#/$defs/hex" }, "description": "The last (up to 10) headers, NEWEST-first, as scorex bytes." },
        "preHeader": {
          "type": "object", "required": ["version", "parentId", "timestamp", "nBits", "height", "minerPk", "votes"],
          "additionalProperties": false,
          "properties": {
            "version":   { "type": "integer", "minimum": 0, "maximum": 255, "description": "The block version, an unsigned byte 0..255 (the activated script version it implies is (version - 1).toByte)." },
            "parentId":  { "$ref": "#/$defs/hex" },
            "timestamp": { "type": "string", "pattern": "^[0-9]+$", "$comment": "u64 as a string (lossless)." },
            "nBits":     { "type": "integer", "minimum": 0 },
            "height":    { "type": "integer", "minimum": 0 },
            "minerPk":   { "$ref": "#/$defs/hex" },
            "votes":     { "$ref": "#/$defs/hex" }
          }
        },
        "parameters": {
          "type": "object",
          "required": ["maxBlockCost", "storageFeeFactor", "minValuePerByte", "inputCost", "dataInputCost", "outputCost", "tokenAccessCost"],
          "additionalProperties": false,
          "properties": {
            "maxBlockCost":    { "type": "integer", "minimum": 0 },
            "storageFeeFactor":{ "type": "integer", "minimum": 0 },
            "minValuePerByte": { "type": "integer", "minimum": 0 },
            "inputCost":       { "type": "integer", "minimum": 0 },
            "dataInputCost":   { "type": "integer", "minimum": 0 },
            "outputCost":      { "type": "integer", "minimum": 0 },
            "tokenAccessCost": { "type": "integer", "minimum": 0 },
            "blockVersion":    { "type": "integer", "minimum": 0, "maximum": 255, "description": "The voted block version (currentParameters.blockVersion), an unsigned byte 0..255. Drives the activated script version and the monotonic creation-height rule. Optional; defaults to preHeader.version (they are equal in every vector that omits it)." }
          }
        },
        "context": {
          "type": "object", "required": ["height"], "additionalProperties": false,
          "properties": { "height": { "type": "integer", "minimum": 0 } }
        },
        "version": { "$ref": "#/$defs/version" },
        "expected": {
          "type": "object", "required": ["valid", "cost", "reason"], "additionalProperties": false,
          "properties": {
            "valid": { "type": "boolean" },
            "cost": { "oneOf": [ { "type": "integer", "minimum": 0 }, { "type": "null" } ] },
            "reason": { "oneOf": [ { "type": "string" }, { "type": "null" } ] }
          },
          "allOf": [
            { "$comment": "valid:false carries a reason; valid:true has cost and null reason.",
              "if": { "properties": { "valid": { "const": true } } },
              "then": { "properties": { "reason": { "type": "null" } } } }
          ]
        }
      }
    },
    "version": {
      "type": "object", "required": ["activated", "ergoTree"], "additionalProperties": false,
      "properties": {
        "activated": { "type": "integer", "minimum": -128, "maximum": 127, "description": "The activated script version = (blockVersion - 1).toByte, a signed byte: block version 0 gives -1, and versions 129..255 give -128..-2 (e.g. block version 200 -> -57)." },
        "ergoTree": { "type": "integer", "minimum": 0, "maximum": 127 }
      }
    },
    "hex": { "type": "string", "pattern": "^([0-9a-f]{2})*$", "$comment": "lower-case hex, whole bytes (empty allowed for e.g. no data-inputs list element)." }
  }
}
