{
  "schema" : "santa-transaction/v1",
  "op" : "tx:authored:sized-tree-spend",
  "blessed_by" : "jvm:ergo-core-6.0.6-validateStateful",
  "entries" : [
    {
      "name" : "if-rule-1001-degraded-spend-reject#0",
      "source" : "santa:authored-tx-sized-tree-requests:spend",
      "description" : "The spent box's tree is the size-flagged v0 tree If(false, Int 1, sigmaProp(true)) (08 07 95 01 00 04 02 08 d3). The JVM builds If without comparing its branch types and types it as its true branch, Int, so rule 1001 degrades the tree at ingest. A spend interprets that UnparsedErgoTree, whose error is not a soft fork, and throws: the transaction is invalid. An impl that parses the tree leniently evaluates it to sigmaProp(true) and accepts. The input spends a box of value 1000000000 into one output of the same value; no proof unless noted.",
      "tx_bytes_hex" : "01350c330bc3a3bd03cda5dcd8d24885c41d4d796264669c666585055f7de6429c00000000018094ebdc030008d3010000",
      "input_boxes_hex" : [
        "8094ebdc030807950100040208d301000059f30d6756d1411e2268174e23033709b4bb1d5bba9a1b7626cab4815f92b68000"
      ],
      "data_input_boxes_hex" : [
      ],
      "headers_hex" : [
        "04c1caac521fe75f5af2aeda4f5acd787293f23209b465bed62d1851d2d4994a784d41efc816f855d9d6e3cab68be6453b1d7c9a5a815016bcecd68f05509dc194a36723709ba917c6d25a3d9affd01f6caabbee498db075fc83e3ab4ccc4137554594ba1b326d52cb4016a5920da9beffc00aa7048e145ac6cbac616c18de7d7e00c0fda7df97317fee7f826c9c972c1988ec589ae8a994a1c5dc3dbf2d5d473a586cf0ec631c3f07000000bf9440000000000279be667ef9dcbbac55a06295ce870b07029bfcdb2dce28d959f2815b16f817989225fc410e1f522e",
        "04fba7b5a3a9329c9b5004565d39d389a92728234a7b3dd57787e952216313211657e97c8d17edd231cd3615ab90e5f8dda56dfe980b3d04760f91b8795b7038f2caf1db5a8dab61a6a4527e0d6c86de887cba6ab6682ae1cb210ca8e6c547b6a29ac538923511ab00321d46b9340194aa0f2c802f1f2ac15edd6e3fb414ae95620080d4a0df9731525db7fb27f763c83d3010f310b818c0c2ee0f0d0c4172b6edc7f4008990208e07000000be9440000000000279be667ef9dcbbac55a06295ce870b07029bfcdb2dce28d959f2815b16f81798b5c965dbe72a3e11",
        "04d71dbbd6aaa111efd1314b2ead5af0db3c738605cc089548e9ce918eb2065901dff9fdef3f61dd893b676271eb3661558f128927f85a4a70288851cc01149523e6ee2d8927d125d07bf5f9d2f3627b9c916c0149f548f3750d0a94fffbfe1604fa61657937ba46b47ccb752740c8725df666a0b1fab1cdd878037140df797abe00c0aa99df9731b5aebfa58e19cb68652782616fbc65ee1f20ddfc5aa2d678049a0609097c463507000000bd9440000000000279be667ef9dcbbac55a06295ce870b07029bfcdb2dce28d959f2815b16f81798b3683ebd96f50b61",
        "04b9436017aa6f0e7e64a6f7ea3d3ed57c15ea93fc981c43ea3831eb5d24a821ca6c89208914bdfcfa01fc6be432a09145619d0b6d93f903137039e7c33467c16f342ccf5f126b33581979958f159ed17c0dbd0bb646d680fc0cd8f5f916aba1804d82c0cb7f07ba596d009b868b05b6ef2604964cf50153f6ec600e16c6e01e5300808192df97316d1cb58448e2ca5c4f6a9c41fc290686259b7f26dc3c63c7c46f77e5900ec66007000000bc9440000000000279be667ef9dcbbac55a06295ce870b07029bfcdb2dce28d959f2815b16f817983c4bf69345b88459",
        "04ed6e0d182dc6819e5d22acfcb114482604261245752dd224ac450f93a374c544c4f8942fef53cae03e6f4304a3e33f9e4de5af43b67170c91f32f8d4719646863e4677fdaec79fb86aad09c05041b4e07bd1b716e9b07dbe4cf55422be85beda604719bf6b5d4a1a144d687664337399e4490e963e38e8bf373a3575923717a800c0d78adf97317aa177ac41e27f9d5199e6eeb93d6f24ff70f991e2c5d04d983fd5ebdba188ef07000000bb9440000000000279be667ef9dcbbac55a06295ce870b07029bfcdb2dce28d959f2815b16f81798bcee599c779fc0fa",
        "0447115aea6bc613486f5943f30cc6ee4295150204e2d14c1ff2acb2173fe240020213940327a4e1f84703e993eee4938cbf4d772a62742dce9b8ef37d9f4bb91d23ffdaa2516778331153d666aa732d2b4dccb569a8cfff97f2a88c1a2b4f25a0be18fdc6880b9316bf32a8e731a3067f713173a9093fd515cdd20ec6c644f2190080ae83df97319c64e04ff8b4d062710115604d79e00eedd94dffa317322541ec952895a30f5b07000000ba9440000000000279be667ef9dcbbac55a06295ce870b07029bfcdb2dce28d959f2815b16f8179839f349029be38ce4",
        "04781296915c76389f11eb0346276ab02577e22033b7faa062114d99e5462858a90f61445d623e935c28037c0ae3e4395b68ba2fc30082e8e47c262c618a520382f13a69ffc175cefaf7a81b9aa9e5eebd8176a0f5f6a9c55d55edaa15563a6da983323a723f95427ea84697dbcb6c2d34e9b07937fbb4d04fdc8591443f28473700c084fcde973118901dc8f566b4c85d7ace85e51509585f9fbd7dd922a7042b97349db1a4246a07000000b99440000000000279be667ef9dcbbac55a06295ce870b07029bfcdb2dce28d959f2815b16f81798ef17cca94bf415ed",
        "046d1ff4439a835bbd9503c3a76571fa516bc83996b34de61f1baa97a4f0e06ae46334159eb1cafe53d00b2ee85427b29774f84cd86639917b80aa0b00d777957ba8fe41c2e2db5eedcea6ab003779b7904373923208e280c613759f714c0ccc9877fbdef606e6da97c11f3878093a84dcad5caab5def1046c8f5945699be99ced0080dbf4de9731811d928dcb52ba641fda8b7f9b99286eb364faf6807f2c3588956db9c05180c707000000b89440000000000279be667ef9dcbbac55a06295ce870b07029bfcdb2dce28d959f2815b16f8179864ab88b755197af6",
        "0470412fafeea326a283a405fa0747599dd4dea48a6a99d9d13663720152453e22f890b200cdcb7437da1359556a5c5c77dad25115406026271581740ba2cdcd0464efe064fc410db364e5d6f18abd798db39ab4420facdcc24fcce934f4a1e5c7d9a4b1abbb9f967b478cf5d9eb7e211031961132d9deb80816f6b3bc4444255c00c0b1edde9731175467cdb83a812d33adeebced82b7ed2a7ebe9f2fcd4bb61d52135bd5a150ff07000000b79440000000000279be667ef9dcbbac55a06295ce870b07029bfcdb2dce28d959f2815b16f81798d85a6b82d6a0d208",
        "040db48c213ed59833b81a23b035b70e3f3521162096a8ce978b5ebca25d354105b2d1abf2a685819ecfb92875b84e798c350bb1d981d55fce314440de2a7a7b91c4aa6269656cadd79c30aa0f3e50c2e953575775f4650bb6e94fae98224bc4075939d4ccca953674d1dc2b10b7ed5de364be72fa123eb3083da3dcceb248e3ad008088e6de9731f222e589717d16b531121d9139a12a63be19f24436d3d36cfa8a161f7e53684407000000b69440000000000279be667ef9dcbbac55a06295ce870b07029bfcdb2dce28d959f2815b16f817980f26d9cf952658d8"
      ],
      "preHeader" : {
        "version" : 4,
        "parentId" : "11d13a2450fd4a5eed3efd0d319afa093bd943a1f4e43c56bcdcb083dc3b0e0e",
        "timestamp" : "1690001200000",
        "nBits" : 117440512,
        "height" : 1051200,
        "minerPk" : "0279be667ef9dcbbac55a06295ce870b07029bfcdb2dce28d959f2815b16f81798",
        "votes" : "000000"
      },
      "parameters" : {
        "maxBlockCost" : 1000000,
        "storageFeeFactor" : 1250000,
        "minValuePerByte" : 360,
        "inputCost" : 2000,
        "dataInputCost" : 100,
        "outputCost" : 100,
        "tokenAccessCost" : 100
      },
      "context" : {
        "height" : 1051200
      },
      "version" : {
        "activated" : 3,
        "ergoTree" : 0
      },
      "expected" : {
        "valid" : false,
        "cost" : null,
        "reason" : "org.ergoplatform.validation.MalformedModifierError: Scripts of all transaction inputs should pass verification. cadad8273eb388799779e9d5d2916b4034e25411b1302e00f4d0631d5d6afb4c: #0 => Failure(sigma.exceptions.InterpreterException: Script has not been recognized due to ValidationException, and it cannot be accepted as soft-fork.)"
      }
    },
    {
      "name" : "if-true-branch-sigmaprop-accept#1",
      "source" : "santa:authored-tx-sized-tree-requests:spend",
      "description" : "The twin: If(true, sigmaProp(true), Int 1), size-flagged. Typed as its true branch, a SigmaProp, it parses, and it evaluates to sigmaProp(true): valid. The input spends a box of value 1000000000 into one output of the same value; no proof unless noted.",
      "tx_bytes_hex" : "01a0ffababfe2f4e1346b23588dc4b043c41e685b3344f4eeafa18ed64af382dad00000000018094ebdc030008d3010000",
      "input_boxes_hex" : [
        "8094ebdc03080795010108d30402010000576e9bccfcf9847027807775268a0c5b7e3fc6bf3c7734a4279a715404eeab4000"
      ],
      "data_input_boxes_hex" : [
      ],
      "headers_hex" : [
        "04c1caac521fe75f5af2aeda4f5acd787293f23209b465bed62d1851d2d4994a784d41efc816f855d9d6e3cab68be6453b1d7c9a5a815016bcecd68f05509dc194a36723709ba917c6d25a3d9affd01f6caabbee498db075fc83e3ab4ccc4137554594ba1b326d52cb4016a5920da9beffc00aa7048e145ac6cbac616c18de7d7e00c0fda7df97317fee7f826c9c972c1988ec589ae8a994a1c5dc3dbf2d5d473a586cf0ec631c3f07000000bf9440000000000279be667ef9dcbbac55a06295ce870b07029bfcdb2dce28d959f2815b16f817989225fc410e1f522e",
        "04fba7b5a3a9329c9b5004565d39d389a92728234a7b3dd57787e952216313211657e97c8d17edd231cd3615ab90e5f8dda56dfe980b3d04760f91b8795b7038f2caf1db5a8dab61a6a4527e0d6c86de887cba6ab6682ae1cb210ca8e6c547b6a29ac538923511ab00321d46b9340194aa0f2c802f1f2ac15edd6e3fb414ae95620080d4a0df9731525db7fb27f763c83d3010f310b818c0c2ee0f0d0c4172b6edc7f4008990208e07000000be9440000000000279be667ef9dcbbac55a06295ce870b07029bfcdb2dce28d959f2815b16f81798b5c965dbe72a3e11",
        "04d71dbbd6aaa111efd1314b2ead5af0db3c738605cc089548e9ce918eb2065901dff9fdef3f61dd893b676271eb3661558f128927f85a4a70288851cc01149523e6ee2d8927d125d07bf5f9d2f3627b9c916c0149f548f3750d0a94fffbfe1604fa61657937ba46b47ccb752740c8725df666a0b1fab1cdd878037140df797abe00c0aa99df9731b5aebfa58e19cb68652782616fbc65ee1f20ddfc5aa2d678049a0609097c463507000000bd9440000000000279be667ef9dcbbac55a06295ce870b07029bfcdb2dce28d959f2815b16f81798b3683ebd96f50b61",
        "04b9436017aa6f0e7e64a6f7ea3d3ed57c15ea93fc981c43ea3831eb5d24a821ca6c89208914bdfcfa01fc6be432a09145619d0b6d93f903137039e7c33467c16f342ccf5f126b33581979958f159ed17c0dbd0bb646d680fc0cd8f5f916aba1804d82c0cb7f07ba596d009b868b05b6ef2604964cf50153f6ec600e16c6e01e5300808192df97316d1cb58448e2ca5c4f6a9c41fc290686259b7f26dc3c63c7c46f77e5900ec66007000000bc9440000000000279be667ef9dcbbac55a06295ce870b07029bfcdb2dce28d959f2815b16f817983c4bf69345b88459",
        "04ed6e0d182dc6819e5d22acfcb114482604261245752dd224ac450f93a374c544c4f8942fef53cae03e6f4304a3e33f9e4de5af43b67170c91f32f8d4719646863e4677fdaec79fb86aad09c05041b4e07bd1b716e9b07dbe4cf55422be85beda604719bf6b5d4a1a144d687664337399e4490e963e38e8bf373a3575923717a800c0d78adf97317aa177ac41e27f9d5199e6eeb93d6f24ff70f991e2c5d04d983fd5ebdba188ef07000000bb9440000000000279be667ef9dcbbac55a06295ce870b07029bfcdb2dce28d959f2815b16f81798bcee599c779fc0fa",